[
  {
    "id": "ss.a.guidance-and-experience",
    "kind": "uniqueAction",
    "name": "GUIDANCE AND EXPERIENCE",
    "team": "scout-squad",
    "ap": 0,
    "effect": {
      "code": "ssGuidance"
    },
    "text": "Free action, once in each of the Sergeant's activations: pick another friendly Scout Squad operative anywhere in the killzone. It gets +1 APL until the end of its next activation.",
    "source": "team-scout-squad.pdf (Apr '26); docs/spec/13-teams.md T-SS.6"
  },
  {
    "id": "ss.a.astartes",
    "kind": "ability",
    "name": "ASTARTES",
    "team": "scout-squad",
    "text": "In each of its activations the Sergeant may Shoot twice or Fight twice (not both pairs). With two Shoots at least one uses a bolt weapon. The Sergeant can counteract whatever its order.",
    "source": "team-scout-squad.pdf (Apr '26); docs/spec/13-teams.md T-SS.7"
  },
  {
    "id": "ss.a.heavy-weapon-bipod",
    "kind": "ability",
    "name": "Heavy Weapon Bipod",
    "team": "scout-squad",
    "text": "When the Heavy Gunner shoots with a weapon from its datacard and has not moved this activation (or it is a counteraction), that weapon has Ceaseless; one that already has Ceaseless gains Relentless instead.",
    "source": "team-scout-squad.pdf (Apr '26); docs/spec/13-teams.md T-SS.8"
  },
  {
    "id": "ss.a.grapnel-launcher",
    "kind": "ability",
    "name": "Grapnel Launcher",
    "team": "scout-squad",
    "text": "Whenever the Hunter climbs up, the climb counts as 2 inches of vertical distance however high it goes.",
    "source": "team-scout-squad.pdf (Apr '26); docs/spec/13-teams.md T-SS.9"
  },
  {
    "id": "ss.a.grapnel-assault",
    "kind": "ability",
    "name": "Grapnel Assault",
    "team": "scout-squad",
    "text": "When the Hunter charges and in that Charge climbs, drops, jumps or passes under Vantage terrain, its melee weapons have Lethal 3+ until the end of that activation.",
    "source": "team-scout-squad.pdf (Apr '26); docs/spec/13-teams.md T-SS.10"
  },
  {
    "id": "ss.a.camo-cloak",
    "kind": "ability",
    "name": "Camo Cloak",
    "team": "scout-squad",
    "text": "While shot, the Sniper ignores Saturate and, if it can retain any cover saves, retains one more or retains one as a crit (not stacking with the Vantage improvement).",
    "source": "team-scout-squad.pdf (Apr '26); docs/spec/13-teams.md T-SS.11"
  },
  {
    "id": "ss.a.optics",
    "kind": "uniqueAction",
    "name": "OPTICS",
    "team": "scout-squad",
    "ap": 1,
    "conditions": {
      "notInEnemyControlRange": true
    },
    "effect": {
      "code": "ssOptics"
    },
    "text": "Not in an enemy control range. Until this operative next activates, enemies cannot be obscured while it shoots them.",
    "source": "team-scout-squad.pdf (Apr '26); docs/spec/13-teams.md T-SS.12"
  },
  {
    "id": "ss.a.track-enemy",
    "kind": "uniqueAction",
    "name": "TRACK ENEMY",
    "team": "scout-squad",
    "ap": 1,
    "conditions": {
      "notInEnemyControlRange": true
    },
    "effect": {
      "code": "ssTrackEnemy"
    },
    "text": "Not in an enemy control range. Pick one enemy within 8 inches (no sight needed). Until the end of the turning point friendly Scout Squad operatives shooting it have Seek Light on their ranged weapons.",
    "source": "team-scout-squad.pdf (Apr '26); docs/spec/13-teams.md T-SS.13"
  },
  {
    "id": "ss.a.auspex-scan",
    "kind": "uniqueAction",
    "name": "AUSPEX SCAN",
    "team": "scout-squad",
    "ap": 1,
    "conditions": {
      "notInEnemyControlRange": true
    },
    "effect": {
      "code": "ssAuspexScan"
    },
    "text": "Not in an enemy control range. Until this operative next activates (or is incapacitated), a Scout Squad operative shooting an enemy within 8 inches of it ignores the obscured status, and an Optics Sniper shooting it also has Seek Light.",
    "source": "team-scout-squad.pdf (Apr '26); docs/spec/13-teams.md T-SS.14"
  },
  {
    "id": "ss.a.adaptive-equipment",
    "kind": "ability",
    "name": "Adaptive Equipment",
    "team": "scout-squad",
    "text": "Once per turning point one friendly Warrior may perform Smoke Grenade, and once per turning point one may perform Stun Grenade, without using your grenade equipment.",
    "source": "team-scout-squad.pdf (Apr '26); docs/spec/13-teams.md T-SS.15"
  },
  {
    "id": "ss.a.forward-scouting",
    "kind": "factionRule",
    "name": "FORWARD SCOUTING",
    "team": "scout-squad",
    "scope": {
      "side": "friendly",
      "keyword": "SCOUT SQUAD"
    },
    "effect": {
      "code": "ssForwardScouting"
    },
    "text": "After both kill teams are set up and before turning point 1, make up to six picks from: Redeploy (once), Reposition (twice), Trip Alarm (twice), Booby Trap (once), Tactical Manoeuvre (once), Diversion (once), Devise Plan (once), Designate Target (once). Picks alternate with any opponent that also has pre-battle picks, starting with the setup initiative holder.",
    "source": "team-scout-squad.pdf (Apr '26); docs/spec/13-teams.md T-SS.16"
  }
]
