[
  {
    "id": "ks.a.wr-concealed-position",
    "kind": "weaponRule",
    "name": "Concealed Position",
    "team": "kasrkin",
    "weaponRule": {
      "param": "none"
    },
    "effect": {
      "code": "ksConcealedPosition"
    },
    "text": "The hot-shot marksman rifle's concealed profile can only be used in the Sharpshooter's first Shoot action of the battle.",
    "source": "team-kasrkin.pdf (Apr '26); docs/spec/13-teams.md T-KS.16"
  },
  {
    "id": "ks.a.tactical-command",
    "kind": "uniqueAction",
    "name": "TACTICAL COMMAND",
    "team": "kasrkin",
    "ap": 0,
    "conditions": {
      "notInEnemyControlRange": true
    },
    "effect": {
      "code": "ksTacticalCommand"
    },
    "text": "Free action (not in an enemy control range). Pick any friendly Kasrkin and give it one Skill at Arms it does not already have until the Ready step of the next Strategy phase; a second use on the same operative replaces the first. Or, if your Clearance Sweep marker is in play, pick it up and place it again anywhere.",
    "source": "team-kasrkin.pdf (Apr '26); docs/spec/13-teams.md T-KS.7"
  },
  {
    "id": "ks.a.veteran-leadership",
    "kind": "ability",
    "name": "Veteran Leadership",
    "team": "kasrkin",
    "effect": {
      "code": "ksVeteranLeadership"
    },
    "text": "While the Sergeant is in the killzone, the Skill at Arms gambit lets you pick two different skills instead of one.",
    "source": "team-kasrkin.pdf (Apr '26); docs/spec/13-teams.md T-KS.8"
  },
  {
    "id": "ks.a.medic",
    "kind": "ability",
    "name": "Medic!",
    "team": "kasrkin",
    "window": "operative.incapacitated",
    "effect": {
      "code": "ksMedic",
      "params": {
        "range": 3,
        "wounds": 1,
        "aplDelta": -1
      }
    },
    "text": "The first time each turning point a friendly Kasrkin within 3 inches that this operative can see would go down (neither of them in an enemy control range), it is kept on 1 wound and cannot be taken down for the rest of that action. After the action it may Dash into the Combat Medic's control range, both then have -1 APL until their next activations end, and if it happened in the casualty's own activation that activation ends. Not while the Combat Medic is down or is itself a target of that Shoot.",
    "source": "team-kasrkin.pdf (Apr '26); docs/spec/13-teams.md T-KS.9"
  },
  {
    "id": "ks.a.medikit",
    "kind": "uniqueAction",
    "name": "MEDIKIT",
    "team": "kasrkin",
    "ap": 0,
    "conditions": {
      "notInEnemyControlRange": true
    },
    "effect": {
      "code": "ksMedikit",
      "params": {
        "dice": "2D3"
      }
    },
    "text": "Free action (not in an enemy control range). A friendly Kasrkin in this operative's control range, itself included, regains up to 2D3 lost wounds. Whoever Medic! saved this turning point cannot be treated.",
    "source": "team-kasrkin.pdf (Apr '26); docs/spec/13-teams.md T-KS.10"
  },
  {
    "id": "ks.a.melta-mine",
    "kind": "ability",
    "name": "Melta Mine",
    "team": "kasrkin",
    "effect": {
      "code": "ksMeltaMine"
    },
    "text": "The Demo-Trooper starts the battle carrying your Melta Mine marker, and only it can pick the marker up again. It sets the mine down with the Place Marker action (never within an enemy control range) and may then take a free Dash. If it falls while carrying the mine and there is no legal spot for it, the marker goes with it.",
    "source": "team-kasrkin.pdf (Apr '26); docs/spec/13-teams.md T-KS.11"
  },
  {
    "id": "ks.a.proximity-mine",
    "kind": "ability",
    "name": "Proximity Mine",
    "team": "kasrkin",
    "effect": {
      "code": "ksProximityMine",
      "params": {
        "damage": "2D6+3"
      }
    },
    "text": "The first time a placed Melta Mine marker is within the control range of any operative other than the Demo-Trooper (friend or foe), it is removed and that operative takes 2D6+3 damage. If it survives, whatever action it was performing stops there, unfinished.",
    "source": "team-kasrkin.pdf (Apr '26); docs/spec/13-teams.md T-KS.12"
  },
  {
    "id": "ks.a.blast-padding",
    "kind": "ability",
    "name": "Blast Padding",
    "team": "kasrkin",
    "effect": {
      "code": "ksBlastPadding"
    },
    "text": "When shot with a Blast or Torrent weapon (unless that weapon has a sweeping profile) the Demo-Trooper may re-roll one defence die, and Devastating damage with a distance never reaches it unless it is the target.",
    "source": "team-kasrkin.pdf (Apr '26); docs/spec/13-teams.md T-KS.13"
  },
  {
    "id": "ks.a.reconnoitre-killzone",
    "kind": "ability",
    "name": "Reconnoitre Killzone",
    "team": "kasrkin",
    "effect": {
      "code": "ksReconnoitre"
    },
    "text": "RELOCATE costs 0 CP when this operative is the one it picks first.",
    "source": "team-kasrkin.pdf (Apr '26); docs/spec/13-teams.md T-KS.14"
  },
  {
    "id": "ks.a.auspex-scan",
    "kind": "uniqueAction",
    "name": "AUSPEX SCAN",
    "team": "kasrkin",
    "ap": 1,
    "conditions": {
      "notInEnemyControlRange": true
    },
    "effect": {
      "code": "ksAuspexScan",
      "params": {
        "range": 8
      }
    },
    "text": "Not in an enemy control range. Until this operative next activates (or is incapacitated), every enemy within 8 inches of it is scanned: friendly Kasrkin shooting a scanned enemy ignore the obscured status.",
    "source": "team-kasrkin.pdf (Apr '26); docs/spec/13-teams.md T-KS.15"
  },
  {
    "id": "ks.a.camo-cloak",
    "kind": "ability",
    "name": "Camo Cloak",
    "team": "kasrkin",
    "effect": {
      "code": "ksCamoCloak"
    },
    "text": "While shot, the Sharpshooter ignores Saturate and, if it can retain any cover saves, retains one more or retains one as a crit (not stacking with the Vantage improvement).",
    "source": "team-kasrkin.pdf (Apr '26); docs/spec/13-teams.md T-KS.17"
  },
  {
    "id": "ks.a.adaptive-equipment",
    "kind": "ability",
    "name": "Adaptive Equipment",
    "team": "kasrkin",
    "effect": {
      "code": "ksAdaptiveEquipment"
    },
    "text": "Once per turning point one friendly Trooper may perform Smoke Grenade, and once per turning point one may perform Stun Grenade, without using your grenade equipment.",
    "source": "team-kasrkin.pdf (Apr '26); docs/spec/13-teams.md T-KS.18"
  },
  {
    "id": "ks.a.battle-comms",
    "kind": "uniqueAction",
    "name": "BATTLE COMMS",
    "team": "kasrkin",
    "ap": 1,
    "conditions": {
      "notInEnemyControlRange": true
    },
    "effect": {
      "code": "ksBattleComms"
    },
    "text": "Not in an enemy control range. Another friendly Kasrkin gets +1 APL until the end of its next activation, never taking it above 3. The Vox-Trooper may perform this twice in one activation.",
    "source": "team-kasrkin.pdf (Apr '26); docs/spec/13-teams.md T-KS.19"
  },
  {
    "id": "ks.a.rapid-fire",
    "kind": "factionRule",
    "name": "RAPID FIRE",
    "team": "kasrkin",
    "scope": {
      "side": "friendly",
      "keyword": "KASRKIN"
    },
    "effect": {
      "code": "ksRapidFire"
    },
    "text": "A Kasrkin that performs no action in which it moves in its activation may Shoot twice, provided both Shoots use a bolt pistol, hot-shot lasgun or hot-shot laspistol. Guard cannot be one of the two, and after two Shoots it cannot move or Guard.",
    "source": "team-kasrkin.pdf (Apr '26); docs/spec/13-teams.md T-KS.25"
  },
  {
    "id": "ks.a.light-em-up",
    "kind": "factionRule",
    "name": "Light 'Em Up",
    "team": "kasrkin",
    "scope": {
      "side": "friendly",
      "keyword": "KASRKIN"
    },
    "effect": {
      "code": "ksLightEmUp"
    },
    "text": "Skill at Arms. The operative's ranged weapons have Severe.",
    "source": "team-kasrkin.pdf (Apr '26); docs/spec/13-teams.md T-KS.21"
  },
  {
    "id": "ks.a.strike-fast",
    "kind": "factionRule",
    "name": "Strike Fast",
    "team": "kasrkin",
    "scope": {
      "side": "friendly",
      "keyword": "KASRKIN"
    },
    "effect": {
      "code": "ksStrikeFast"
    },
    "text": "Skill at Arms. +1 inch of Move while the operative performs Reposition (free Repositions included).",
    "source": "team-kasrkin.pdf (Apr '26); docs/spec/13-teams.md T-KS.22"
  },
  {
    "id": "ks.a.ice-in-your-veins",
    "kind": "factionRule",
    "name": "Ice In Your Veins",
    "team": "kasrkin",
    "scope": {
      "side": "friendly",
      "keyword": "KASRKIN"
    },
    "effect": {
      "code": "ksIceInYourVeins"
    },
    "text": "Skill at Arms. While the operative fights, retaliates or is shot, the first attack die of that sequence that would deal it Normal Dmg 3 or more deals 1 less. Crits and Devastating damage are never reduced.",
    "source": "team-kasrkin.pdf (Apr '26); docs/spec/13-teams.md T-KS.23"
  },
  {
    "id": "ks.a.for-cadia",
    "kind": "factionRule",
    "name": "For Cadia!",
    "team": "kasrkin",
    "scope": {
      "side": "friendly",
      "keyword": "KASRKIN"
    },
    "effect": {
      "code": "ksForCadia"
    },
    "text": "Skill at Arms. The operative's melee weapons get Atk +1 (to no more than 4), and its first strike when it fights (not retaliating) deals 1 extra damage.",
    "source": "team-kasrkin.pdf (Apr '26); docs/spec/13-teams.md T-KS.24"
  }
]
